{
  "schema_version": "1.0",
  "type": "task",
  "id": "task-20260531-100000-1234abcd",
  "status": "pending",
  "created_at": "2026-05-31T14:00:00.0000000+00:00",
  "requester": "codex",
  "assignee": "claude",
  "role": "code-reviewer",
  "prompt": "Review D:\\project\\src\\auth.dart for security issues and return markdown findings.",
  "context_files": [
    "D:\\project\\src\\auth.dart"
  ],
  "requirements": [
    "Findings first.",
    "Include file and line references."
  ],
  "output_format": "markdown",
  "parent_id": null,
  "metadata": {
    "bridge_root": "C:\\ai-bridge"
  }
}
